<?xml version="1.0" encoding="UTF-8"?>
<Contractor xmlns:xsi="http://www.w3.org/2001/XMLSchema-instance" xsi:noNamespaceSchemaLocation="XSD/contractor.xsd">
  <Paths>
    <BackendDestinationFolder>..\FullstackTemplate\Krz.FullstackTemplate.Backends\Krz.FullstackTemplate.Backend.Core</BackendDestinationFolder>
    <DbDestinationFolder>..\FullstackTemplate\Krz.FullstackTemplate.Databases\Krz.FullstackTemplate.Database.Core</DbDestinationFolder>
    <FrontendDestinationFolder>..\FullstackTemplate\Krz.FullstackTemplate.Frontends\Krz.FullstackTemplate.Web.Core</FrontendDestinationFolder>
    <ProjectName>Krz.FullstackTemplate.Backend.Core</ProjectName>
    <DbProjectName>Krz.FullstackTemplate.Database.Core</DbProjectName>
    <DbContextName>FullstackTemplateCoreDbContext</DbContextName>
  </Paths>
  <Replacements>
    <Replacement pattern="app-search-dropdown" replaceWith="search-dropdown" />
    <Replacement pattern="app-table-filter-bar" replaceWith="table-filter-bar" />
    <Replacement pattern="src/app/components/ui/dropdown-data-source/dropdown-pagination-data-source" replaceWith="@krz/material" />
    <Replacement pattern="src/app/components/ui/search-dropdown/search-dropdown.module" replaceWith="@krz/material" />
    <Replacement pattern="src/app/components/ui/table-filter-bar/table-filter-bar.module" replaceWith="@krz/material" />
    <Replacement pattern="src/app/components/ui/file-picker/file-picker.module" replaceWith="@krz/material" />
    <Replacement pattern="src/app/services/backend/pagination/i-paged-result" replaceWith="@krz/material" />
    <Replacement pattern="src/app/services/backend/pagination/i-pagination-options" replaceWith="@krz/material" />
    <Replacement pattern="src/app/services/backend/pagination/pagination.data-source" replaceWith="@krz/material" />
    <Replacement pattern="Contract.Architecture.Backend.Common" replaceWith="Krz.FullstackTemplate.Backend.Common" />
  </Replacements>
  <Includes>
    <Include src="./contractor-mandanten.xml" />
  </Includes>
  <Modules>
    <Module name="Bankwesen">
      <Entity name="Konto" namePlural="Konten" scopeEntityName="Mandant">
        <Property name="Bezeichnung" type="String:256" />
        <Relation1ToN entityNameFrom="Kunde" onDelete="Cascade" />
        <Relation1To1 entityNameFrom="Kunde" propertyNameFrom="BäckupKunde" propertyNameTo="BäckupKonto" optional="true" onDelete="ClientSetNull" />
        <Index property="Bezeichnung" unique="true" />
      </Entity>
      <Entity name="SchöneBank" namePlural="SchöneBänke" scopeEntityName="Mandant">
        <Property name="Name" type="String:256" />
        <Index property="Name,MandantId" clustered="true" unique="true" />
      </Entity>
    </Module>
    <Module name="Kundenstamm">
      <Entity name="Kunde" namePlural="Kunden">
        <Property name="VorUndNachname" type="String:256" displayProperty="true" />
        <Relation1ToN entityNameFrom="SchöneBank" propertyNameFrom="MeineBank" propertyNameTo="MeineKunden" optional="true" />
        <Relation1To1 entityNameFrom="SchöneBank" propertyNameFrom="LieblingsBank" propertyNameTo="LieblingsKunde" />
        <Index property="VorUndNachname" clustered="true" />
      </Entity>
    </Module>
    <Module name="PropertyTesting">
      <Entity name="PropertyTest" namePlural="PropertyTests">
        <Property name="TestString" type="String:256" />
        <Property name="TestGuid" type="Guid" />
        <Property name="TestDouble" type="Double" />
        <Property name="TestBoolean" type="Boolean" />
        <Property name="TestInteger" type="Integer" />
        <Property name="TestDateTime" type="DateTime" />
        <Property name="TestByteArray" type="ByteArray" />
        <Property name="OptionalTestString" type="String:256" optional="true" />
        <Property name="OptionalTestGuid" type="Guid" optional="true" />
        <Property name="OptionalTestDouble" type="Double" optional="true" />
        <Property name="OptionalTestBöüleänß" type="Boolean" optional="true" />
        <Property name="OptionalTestInteger" type="Integer" optional="true" />
        <Property name="OptionalTestByteArray" type="ByteArray" optional="true" />
        <Property name="OptionalTestDateTime" type="DateTime" optional="true" />
        <Index property="TestInteger" unique="true" where="[TestInteger] > 0" />
        <Check name="TestDoubleGroesserNull" query="[TestDouble] > 0" />
      </Entity>
    </Module>
  </Modules>
</Contractor>